{
  "$schema": "http://json-schema.org/draft-07/schema#",
  "type": "object",
  "additionalProperties": false,
  "properties": {
    "weather": {
      "type": "object",
      "additionalProperties": false,
      "properties": {
        "apiKey": { "type": "string" },
        "lat": { "type": "number", "minimum": -90, "maximum": 90 },
        "lon": { "type": "number", "minimum": -180, "maximum": 180 },
        "city": { "type": "string" },
        "units": { "type": "string", "enum": ["metric", "imperial"] }
      },
      "required": ["lat", "lon"],
      "dependencies": {
        "units": ["lat", "lon"]
      }
    },
    "theme": {
      "type": "object",
      "additionalProperties": false,
      "properties": {
        "current": { "type": "string" }
      }
    },
    "background": {
      "type": "object",
      "additionalProperties": false,
      "properties": {
        "intervalMinutes": { "type": "integer", "minimum": 1, "maximum": 10080 },
        "mode": { "type": "string", "enum": ["daily", "weekly", "weather"] },
        "retainDays": { "type": "integer", "minimum": 1, "maximum": 90 }
      }
    },
    "tts": {
      "type": "object",
      "additionalProperties": false,
      "properties": {
        "voice": { "type": "string" },
        "volume": { "type": "number", "minimum": 0, "maximum": 1 }
      }
    },
    "wifi": {
      "type": "object",
      "additionalProperties": false,
      "properties": {
        "preferredInterface": { "type": "string" }
      }
    },
    "locale": {
      "type": "object",
      "additionalProperties": false,
      "properties": {
        "country": { "type": "string", "minLength": 2 },
        "autonomousCommunity": { "type": "string" },
        "province": { "type": "string" },
        "city": { "type": "string" }
      }
    },
    "patron": {
      "type": "object",
      "additionalProperties": false,
      "properties": {
        "city": { "type": "string" },
        "name": { "type": "string" },
        "month": { "type": "integer", "minimum": 1, "maximum": 12 },
        "day": { "type": "integer", "minimum": 1, "maximum": 31 }
      }
    },
    "blitzortung": {
      "type": "object",
      "additionalProperties": false,
      "properties": {
        "enabled": { "type": "boolean" },
        "mqtt_host": { "type": ["string", "null"] },
        "mqtt_port": { "type": "integer", "minimum": 1, "maximum": 65535 },
        "topic_base": { "type": "string" },
        "radius_km": { "type": "integer", "minimum": 0, "maximum": 2000 },
        "time_window_min": { "type": "integer", "minimum": 1, "maximum": 360 }
      }
    },
    "ui": {
      "type": "object",
      "additionalProperties": false,
      "properties": {
        "mode": { "type": "string" },
        "overlay": {
          "type": "object",
          "additionalProperties": false,
          "properties": {
            "position": { "type": "string", "enum": ["left", "right"] },
            "width_px": { "type": "integer", "minimum": 280, "maximum": 640 },
            "opacity": { "type": "number", "minimum": 0.3, "maximum": 1 },
            "blur_px": { "type": "integer", "minimum": 0, "maximum": 10 },
            "dwell_seconds": { "type": "integer", "minimum": 3, "maximum": 180 },
            "transition_ms": { "type": "integer", "minimum": 100, "maximum": 10000 },
            "order": {
              "type": "array",
              "items": { "type": "string", "enum": [
                "weather_now",
                "weather_week",
                "moon",
                "season",
                "ephemeris",
                "news",
                "saints",
                "calendar"
              ] },
              "uniqueItems": true
            }
          }
        }
      }
    },
    "geoscope": {
      "type": "object",
      "additionalProperties": false,
      "properties": {
        "enabled": { "type": "boolean" },
        "rotate": { "type": "boolean" },
        "fps_cap": { "type": "integer", "minimum": 1, "maximum": 120 }
      }
    }
  }
}
